"()                 begin try                 declare @enable int;                 select top 1 @enable = convert(int,value_in_use) from sys.configurations where name = 'default trace enabled'                 if @enable = 1 --default trace is enabled                 begin                 declare @curr_tracefilename varchar(500);                 declare @base_tracefilename varchar(500);                 declare @indx int ;                 declare @temp_trace table (                 StartTime datetime                 ,       EventSubClass int                 ,       IntegerData int                 );                 declare @path_separator CHAR(1) ;                 set @path_separator = ISNULL(CONVERT(CHAR(1), serverproperty('PathSeparator')), '\') ;                  select @curr_tracefilename = path from sys.traces where is_default = 1 ;                 set @curr_tracefilename = reverse(@curr_tracefilename)                 select @indx  = PATINDEX('%'+@path_separator+'%', @curr_tracefilename)                 set @curr_tracefilename = reverse(@curr_tracefilename)                 set @base_tracefilename = LEFT( @curr_tracefilename, len(@curr_tracefilename) - @indx) + @path_separator + 'log.trc';                  insert into @temp_trace                 select StartTime                 ,       EventSubClass                 ,       IntegerData                 from ::fn_trace_gettable( @base_tracefilename, default )                 where EventClass = 81;                  update @temp_trace set IntegerData = -IntegerData where EventSubClass = 2;                  select   1 as row_no                 ,       StartTime                 ,       EventSubClass                 ,       IntegerData                 ,       case when IntegerData < 0                 then -IntegerData                 else IntegerData                 end ""Absolute""                 from @temp_trace                 where (datediff(dd,StartTime,getdate()) < 7) order by StartTime ;                 end                 else                 begin                 select top 0 1 as row_no, 1 as StartTime , 1 as EventSubClass, 1 as IntegerData, 1 as Absolute                 end                 end try                 begin catch                 select  -100 as row_no                 ,       ERROR_NUMBER()  as StartTime                 ,       ERROR_SEVERITY() as EventSubClass                 ,       ERROR_STATE()  as   IntegerData                 ,       ERROR_MESSAGE() as Absolute                 end catch               ",1031,1029,2,0,0,3093
"       SELECT       db_id() AS database_id,       c.system_type_id,       c.user_type_id,       c.is_sparse,       c.is_column_set,       c.is_filestream,       c.encryption_type,       CASE WHEN o.object_id IS NOT NULL THEN 1 ELSE 0 END AS is_user,       COUNT_BIG(*) AS [ColCount],       CASE WHEN c.collation_name IS NULL THEN CONVERT(VARCHAR(128), SERVERPROPERTY('Collation')) ELSE c.collation_name END AS collation_name,       AVG(c.max_length) AS avg_max_length       FROM sys.columns c WITH (NOLOCK)       LEFT OUTER JOIN sys.objects o WITH (NOLOCK)       ON o.object_id = c.object_id       AND o.type = 'U'       GROUP BY       c.system_type_id,       c.user_type_id,       c.is_sparse,       c.is_column_set,       c.encryption_type,       c.is_filestream,       CASE WHEN o.object_id IS NOT NULL THEN 1 ELSE 0 END,       CASE WHEN c.collation_name IS NULL THEN CONVERT(VARCHAR(128), SERVERPROPERTY('Collation')) ELSE c.collation_name END     ",441,258,183,329,0,39733
"       SELECT       db_id() AS database_id,       c.system_type_id,       c.user_type_id,       c.is_sparse,       c.is_column_set,       c.is_filestream,       c.encryption_type,       CASE WHEN o.object_id IS NOT NULL THEN 1 ELSE 0 END AS is_user,       COUNT_BIG(*) AS [ColCount],       CASE WHEN c.collation_name IS NULL THEN CONVERT(VARCHAR(128), SERVERPROPERTY('Collation')) ELSE c.collation_name END AS collation_name,       AVG(c.max_length) AS avg_max_length       FROM sys.columns c WITH (NOLOCK)       LEFT OUTER JOIN sys.objects o WITH (NOLOCK)       ON o.object_id = c.object_id       AND o.type = 'U'       GROUP BY       c.system_type_id,       c.user_type_id,       c.is_sparse,       c.is_column_set,       c.encryption_type,       c.is_filestream,       CASE WHEN o.object_id IS NOT NULL THEN 1 ELSE 0 END,       CASE WHEN c.collation_name IS NULL THEN CONVERT(VARCHAR(128), SERVERPROPERTY('Collation')) ELSE c.collation_name END     ",390,228,162,265,0,35167
"with fs as (select database_id, type, CAST ( size as BIGINT ) / 128 size from [master].[sys].[master_files]) select db.name, db.database_id, db.recovery_model_desc, db.state_desc, db.is_in_standby, (SELECT SUM ( CAST ( size as BIGINT ) ) from fs where fs.database_id = db.database_id) DBSizeMB, ag.name as ag_name, ag_rep_states.role_desc, ag_rep_states.operational_state_desc, ag_rep.secondary_role_allow_connections_desc, ls.primary_id, ag.group_id, ag.cluster_type, db.service_broker_guid, is_cdc_enabled from [master].[sys].[databases] db LEFT OUTER JOIN [master].[sys].[availability_databases_cluster] dbc ON db.group_database_id = dbc.group_database_id LEFT OUTER JOIN [master].[sys].[availability_groups] ag ON dbc.group_id = ag.group_id LEFT OUTER JOIN [master].[sys].[dm_hadr_availability_replica_states] ag_rep_states ON db.replica_id = ag_rep_states.replica_id LEFT OUTER JOIN [master].[sys].[availability_replicas] ag_rep ON db.replica_id = ag_rep.replica_id LEFT OUTER JOIN [msdb].[dbo].[log_shipping_monitor_primary] ls ON db.name collate database_default = ls.primary_database collate database_default WHERE source_database_id is NULL",353,273,80,423,0,707
"SELECT     DB_NAME (database_id) as [Database Name],     name as [Database File Name],     [Type] = CASE WHEN Type_Desc = 'ROWS' THEN 'Data File(s)'             WHEN Type_Desc = 'LOG'  THEN 'Log File(s)'             ELSE Type_Desc END,     size*8/1024 as 'Size (MB)',     physical_name as [Database_File_Location] FROM sys.master_files ORDER BY 1,3  IF OBJECT_ID('tempdb.dbo.#space') IS NOT NULL     DROP TABLE #space  CREATE TABLE #space (       database_id INT PRIMARY KEY     , data_used_size DECIMAL(18,2)     , log_used_size DECIMAL(18,2) )  DECLARE @SQL NVARCHAR(MAX)  SELECT @SQL = STUFF((     SELECT '     USE [' + d.name + ']     INSERT INTO #space (database_id, data_used_size, log_used_size)     SELECT           DB_ID()         , SUM(CASE WHEN [type] = 0 THEN space_used END)         , SUM(CASE WHEN [type] = 1 THEN space_used END)     FROM (         SELECT s.[type], space_used = SUM(FILEPROPERTY(s.name, ''SpaceUsed'') * 8. / 1024)         FROM sys.database_files s         GROUP BY s.[type]     ) t;'     FROM sys.databases d     WHERE d.[state] = 0     FOR XML PATH(''), TYPE).value('.', 'NVARCHAR(MAX)'), 1, 2, '')  EXEC sys.sp_executesql @SQL  SELECT       d.database_id     , d.name     , d.state_desc     , d.recovery_model_desc     , t.total_size     , t.data_size     , s.data_used_size     , t.log_size     , s.log_used_size     , bu.full_last_date     , bu.full_size     , bu.log_last_date     , bu.log_size FROM (     SELECT           database_id         , log_size = CAST(SUM(CASE WHEN [type] = 1 THEN size END) * 8. / 1024 AS DECIMAL(18,2))         , data_size = CAST(SUM(CASE WHEN [type] = 0 THEN size END) * 8. / 1024 AS DECIMAL(18,2))         , total_size = CAST(SUM(size) * 8. / 1024 AS DECIMAL(18,2))     FROM sys.master_files     GROUP BY database_id ) t JOIN sys.databases d ON d.database_id = t.database_id LEFT JOIN #space s ON d.database_id = s.database_id LEFT JOIN (     SELECT           database_name         , full_last_date = MAX(CASE WHEN [type] = 'D' THEN backup_finish_date END)         , full_size = MAX(CASE WHEN [type] = 'D' THEN backup_size END)         , log_last_date = MAX(CASE WHEN [type] = 'L' THEN backup_finish_date END)         , log_size = MAX(CASE WHEN [type] = 'L' THEN backup_size END)     FROM (         SELECT               s.database_name             , s.[type]             , s.backup_finish_date             , backup_size =                         CAST(CASE WHEN s.backup_size = s.compressed_backup_size                                     THEN s.backup_size                                     ELSE s.compressed_backup_size                         END / 1048576.0 AS DECIMAL(18,2))             , RowNum = ROW_NUMBER() OVER (PARTITION BY s.database_name, s.[type] ORDER BY s.backup_finish_date DESC)         FROM msdb.dbo.backupset s         WHERE s.[type] IN ('D', 'L')     ) f     WHERE f.RowNum = 1     GROUP BY f.database_name ) bu ON d.name = bu.database_name ORDER BY t.total_size DESC  SELECT      req.session_id     , req.total_elapsed_time AS duration_ms     , req.cpu_time AS cpu_time_ms     , req.total_elapsed_time - req.cpu_time AS wait_time     , req.logical_reads     , SUBSTRING (REPLACE (REPLACE (SUBSTRING (ST.text, (req.statement_start_offset/2) + 1,         ((CASE statement_end_offset            WHEN -1            THEN DATALENGTH(ST.text)              ELSE req.statement_end_offset          END - req.statement_start_offset)/2) + 1) , CHAR(10), ' '), CHAR(13), ' '),        1, 512)  AS statement_text   FROM sys.dm_exec_requests AS req     CROSS APPLY sys.dm_exec_sql_text(req.sql_handle) AS ST ORDER BY total_elapsed_time DESC;  SELECT top 100 t.text,      (qs.total_elapsed_time/1000) / qs.execution_count AS avg_elapsed_time,      (qs.total_worker_time/1000) / qs.execution_count AS avg_cpu_time,      ((qs.total_elapsed_time/1000) / qs.execution_count ) - ((qs.total_worker_time/1000) / qs.execution_count) AS avg_wait_time,      qs.total_logical_reads / qs.execution_count AS avg_logical_reads,      qs.total_logical_writes / qs.execution_count AS avg_writes,      (qs.total_elapsed_time/1000) AS cumulative_elapsed_time_all_executions FROM sys.dm_exec_query_stats qs      CROSS apply sys.Dm_exec_sql_text (sql_handle) t -- WHERE t.text like '<Your Query>%' -- Replace <Your Query> with your query or the beginning part of your query. The special chars like '[','_','%','^' in the query should be escaped. ORDER BY (qs.total_elapsed_time / qs.execution_count) DESC  --Deadlock sql check SELECT     session_id,     start_time,      [status],     command,     blocking_session_id,     wait_type,     wait_time,     open_transaction_count,     transaction_id,     total_elapsed_time,     Definition = CAST(text AS VARCHAR(MAX)) FROM     SYS.DM_EXEC_REQUESTS     CROSS APPLY sys.dm_exec_sql_text(sql_handle)  WHERE blocking_session_id != 0  SELECT sqlserver_start_time, (committed_kb/1024) AS Total_Server_Memory_MB, (committed_target_kb/1024)  AS Target_Server_Memory_MB FROM sys.dm_os_sys_info; ",197,35,162,20784,400,394
"SELECT     DB_NAME (database_id) as [Database Name],     name as [Database File Name],     [Type] = CASE WHEN Type_Desc = 'ROWS' THEN 'Data File(s)'             WHEN Type_Desc = 'LOG'  THEN 'Log File(s)'             ELSE Type_Desc END,     size*8/1024 as 'Size (MB)',     physical_name as [Database_File_Location] FROM sys.master_files ORDER BY 1,3  IF OBJECT_ID('tempdb.dbo.#space') IS NOT NULL     DROP TABLE #space  CREATE TABLE #space (       database_id INT PRIMARY KEY     , data_used_size DECIMAL(18,2)     , log_used_size DECIMAL(18,2) )  DECLARE @SQL NVARCHAR(MAX)  SELECT @SQL = STUFF((     SELECT '     USE [' + d.name + ']     INSERT INTO #space (database_id, data_used_size, log_used_size)     SELECT           DB_ID()         , SUM(CASE WHEN [type] = 0 THEN space_used END)         , SUM(CASE WHEN [type] = 1 THEN space_used END)     FROM (         SELECT s.[type], space_used = SUM(FILEPROPERTY(s.name, ''SpaceUsed'') * 8. / 1024)         FROM sys.database_files s         GROUP BY s.[type]     ) t;'     FROM sys.databases d     WHERE d.[state] = 0     FOR XML PATH(''), TYPE).value('.', 'NVARCHAR(MAX)'), 1, 2, '')  EXEC sys.sp_executesql @SQL  SELECT       d.database_id     , d.name     , d.state_desc     , d.recovery_model_desc     , t.total_size     , t.data_size     , s.data_used_size     , t.log_size     , s.log_used_size     , bu.full_last_date     , bu.full_size     , bu.log_last_date     , bu.log_size FROM (     SELECT           database_id         , log_size = CAST(SUM(CASE WHEN [type] = 1 THEN size END) * 8. / 1024 AS DECIMAL(18,2))         , data_size = CAST(SUM(CASE WHEN [type] = 0 THEN size END) * 8. / 1024 AS DECIMAL(18,2))         , total_size = CAST(SUM(size) * 8. / 1024 AS DECIMAL(18,2))     FROM sys.master_files     GROUP BY database_id ) t JOIN sys.databases d ON d.database_id = t.database_id LEFT JOIN #space s ON d.database_id = s.database_id LEFT JOIN (     SELECT           database_name         , full_last_date = MAX(CASE WHEN [type] = 'D' THEN backup_finish_date END)         , full_size = MAX(CASE WHEN [type] = 'D' THEN backup_size END)         , log_last_date = MAX(CASE WHEN [type] = 'L' THEN backup_finish_date END)         , log_size = MAX(CASE WHEN [type] = 'L' THEN backup_size END)     FROM (         SELECT               s.database_name             , s.[type]             , s.backup_finish_date             , backup_size =                         CAST(CASE WHEN s.backup_size = s.compressed_backup_size                                     THEN s.backup_size                                     ELSE s.compressed_backup_size                         END / 1048576.0 AS DECIMAL(18,2))             , RowNum = ROW_NUMBER() OVER (PARTITION BY s.database_name, s.[type] ORDER BY s.backup_finish_date DESC)         FROM msdb.dbo.backupset s         WHERE s.[type] IN ('D', 'L')     ) f     WHERE f.RowNum = 1     GROUP BY f.database_name ) bu ON d.name = bu.database_name ORDER BY t.total_size DESC  SELECT      req.session_id     , req.total_elapsed_time AS duration_ms     , req.cpu_time AS cpu_time_ms     , req.total_elapsed_time - req.cpu_time AS wait_time     , req.logical_reads     , SUBSTRING (REPLACE (REPLACE (SUBSTRING (ST.text, (req.statement_start_offset/2) + 1,         ((CASE statement_end_offset            WHEN -1            THEN DATALENGTH(ST.text)              ELSE req.statement_end_offset          END - req.statement_start_offset)/2) + 1) , CHAR(10), ' '), CHAR(13), ' '),        1, 512)  AS statement_text   FROM sys.dm_exec_requests AS req     CROSS APPLY sys.dm_exec_sql_text(req.sql_handle) AS ST ORDER BY total_elapsed_time DESC;  SELECT top 100 t.text,      (qs.total_elapsed_time/1000) / qs.execution_count AS avg_elapsed_time,      (qs.total_worker_time/1000) / qs.execution_count AS avg_cpu_time,      ((qs.total_elapsed_time/1000) / qs.execution_count ) - ((qs.total_worker_time/1000) / qs.execution_count) AS avg_wait_time,      qs.total_logical_reads / qs.execution_count AS avg_logical_reads,      qs.total_logical_writes / qs.execution_count AS avg_writes,      (qs.total_elapsed_time/1000) AS cumulative_elapsed_time_all_executions FROM sys.dm_exec_query_stats qs      CROSS apply sys.Dm_exec_sql_text (sql_handle) t -- WHERE t.text like '<Your Query>%' -- Replace <Your Query> with your query or the beginning part of your query. The special chars like '[','_','%','^' in the query should be escaped. ORDER BY (qs.total_elapsed_time / qs.execution_count) DESC  --Deadlock sql check SELECT     session_id,     start_time,      [status],     command,     blocking_session_id,     wait_type,     wait_time,     open_transaction_count,     transaction_id,     total_elapsed_time,     Definition = CAST(text AS VARCHAR(MAX)) FROM     SYS.DM_EXEC_REQUESTS     CROSS APPLY sys.dm_exec_sql_text(sql_handle)  WHERE blocking_session_id != 0   ",162,29,133,18008,366,162
"SELECT ag_rep.group_id, ag_rep.replica_server_name, ag_rep_states.synchronization_health_desc, ag_rep_cluster_nodes.node_name FROM sys.availability_groups ag INNER JOIN sys.availability_replicas ag_rep ON ag.group_id = ag_rep.group_id INNER JOIN sys.dm_hadr_availability_replica_states ag_rep_states on ag.group_id = ag_rep_states.group_id and ag_rep_states.is_local = 1 INNER JOIN sys.dm_hadr_availability_replica_cluster_nodes ag_rep_cluster_nodes on ag.name = ag_rep_cluster_nodes.group_name and ag_rep.replica_server_name = ag_rep_cluster_nodes.replica_server_name",146,112,34,162,0,880
"(@DatabaseName NVarChar(max))begin try   use msdb;  Select distinct t1.name ,       (dense_rank() over (order by backup_start_date desc,t3.backup_set_id))%2 as l1 ,       (dense_rank() over (order by backup_start_date desc,t3.backup_set_id,t6.physical_device_name))%2 as l2 ,       t3.user_name ,       t3.backup_set_id ,       t3.name as backup_name ,       t3.description ,       (datediff( ss,  t3.backup_start_date, t3.backup_finish_date))/60.0 as duration ,       t3.backup_start_date ,       t3.backup_finish_date ,       t3.type as [type] ,       case when (t3.backup_size/1024.0) < 1024 then (t3.backup_size/1024.0)                  when (t3.backup_size/1048576.0) < 1024 then (t3.backup_size/1048576.0)          else (t3.backup_size/1048576.0/1024.0)          end as backup_size  ,       case when (t3.backup_size/1024.0) < 1024 then 'KB'                  when (t3.backup_size/1048576.0) < 1024 then 'MB'          else 'GB'          end as backup_size_unit  ,       t3.first_lsn ,       t3.last_lsn ,       case when t3.differential_base_lsn is null then 'Not Applicable'          else convert( varchar(100),t3.differential_base_lsn)          end as [differential_base_lsn] ,       t6.physical_device_name ,       t6.device_type as [device_type] ,       t3.recovery_model   from sys.databases t1  inner join backupset t3 on (t3.database_name = t1.name )   left outer join backupmediaset t5 on ( t3.media_set_id = t5.media_set_id )  left outer join backupmediafamily t6 on ( t6.media_set_id = t5.media_set_id )  where (t1.name = @DatabaseName)  order by backup_start_date desc,t3.backup_set_id,t6.physical_device_name;   end try  begin catch   select 1 as user_name, 1 as backup_set_id, 1 as backup_name, 1 as description, 1 as duration, 1 as backup_start_date, 1 as backup_finish_date,1 as type, 1 as backup_size, 1 as backup_size_unit ,       ERROR_SEVERITY() as first_lsn ,       ERROR_STATE() as last_lsn ,       1 as differential_base_lsn ,       ERROR_MESSAGE() as physical_device_name ,       1 as device_type, 1 as recovery_model ,       -100 as l1 ,       ERROR_NUMBER() as l2  end catch",138,118,20,8538,0,276
"CREATE   PROCEDURE [dbo].[sp_syscollector_purge_collection_logs]     @reference_date datetime = NULL,     @delete_batch_size int = 500 AS BEGIN     SET NOCOUNT ON      -- Security check (role membership)     IF (NOT (ISNULL(IS_MEMBER(N'dc_proxy'), 0) = 1) AND NOT (ISNULL(IS_MEMBER(N'db_owner'), 0) = 1))     BEGIN         RAISERROR(14677, -1, -1, 'dc_proxy')         RETURN(1) -- Failure     END      IF (@reference_date IS NULL)     BEGIN         SET @reference_date = GETDATE()     END          -- An expired log record is any record of a collection set that is older than      -- the reference date minus the collection set's days_until_expiration     CREATE TABLE #purged_log_ids (log_id BIGINT, package_execution_id uniqueidentifier)          -- Identify logs to purge based on following criteria     -- a) limit max batch size      -- b) do not delete last log record that is a root log record for a collection set     INSERT INTO #purged_log_ids     SELECT TOP (@delete_batch_size) log_id, package_execution_id     FROM syscollector_execution_log_internal as l     INNER JOIN syscollector_collection_sets s ON l.collection_set_id = s.collection_set_id     WHERE s.days_until_expiration > 0     AND @reference_date >= DATEADD(DAY, s.days_until_expiration, l.finish_time)     AND log_id NOT IN (                         SELECT TOP 1 log_id  from syscollector_execution_log_internal                          WHERE parent_log_id IS NULL                          AND collection_set_id = l.collection_set_id                         ORDER BY start_time DESC                         )      DECLARE @purge_log_count int     SELECT @purge_log_count  = COUNT(log_id)      FROM  #purged_log_ids      -- Delete all ssis log records pertaining to expired logs     DELETE FROM dbo.sysssislog         FROM dbo.sysssislog AS s         INNER JOIN #purged_log_ids AS i ON i.package_execution_id = s.executionid              -- Then delete the actual logs     DELETE FROM syscollector_execution_log_internal         FROM syscollector_execution_log_internal AS l         INNER Join #purged_log_ids AS i ON i.log_id = l.log_id       DROP TABLE #purged_log_ids      -- making sure that delete # record does not exceed given delete batch size     DECLARE @orphaned_record_cleanup_count int     SET @orphaned_record_cleanup_count = @delete_batch_size - @purge_log_count      -- Go for another round to cleanup the orphans     -- Ideally, the log heirarchy guarantees that a finish time by a parent log will always     -- be higher than the finish time of any of its descendants.     -- The purge step however does not delete log records with a null finish time     -- A child log can have a null finish time while its parent is closed if there is an     -- error in execution that causes the log to stay open.     -- If such a child log exists, its parent will be purged leaving it as an orphan          -- get orphan records and all their descendants in a cursor and purge them     DECLARE orphaned_log_cursor INSENSITIVE CURSOR FOR             SELECT TOP (@orphaned_record_cleanup_count) log_id              FROM syscollector_execution_log_internal             WHERE parent_log_id NOT IN (                 SELECT log_id FROM syscollector_execution_log_internal             )             FOR READ ONLY                  DECLARE @log_id BIGINT      -- for every orphan, delete all its remaining tree     -- this is supposedly a very small fraction of the entire log     OPEN orphaned_log_cursor         FETCH orphaned_log_cursor INTO @log_id     WHILE @@FETCH_STATUS = 0     BEGIN         EXEC sp_syscollector_delete_execution_log_tree @log_id = @log_id, @from_collection_set = 0         FETCH orphaned_log_cursor INTO @log_id     END          CLOSE orphaned_log_cursor     DEALLOCATE orphaned_log_cursor END ",111,110,1,46783,90,223
"       SELECT db_id() AS database_id,       COUNT_BIG(*) AS [NumExternalStats]       FROM sys.tables t WITH(nolock) INNER JOIN sys.stats s WITH(nolock) ON t.object_id = s.object_id       WHERE t.is_external=1     ",111,66,45,3704,0,2903
"()                 begin try                 if (select convert(int,value_in_use) from sys.configurations where name = 'default trace enabled' ) = 1                 begin                 declare @curr_tracefilename varchar(500) ;                 declare @base_tracefilename varchar(500) ;                 declare @indx int ;                 declare @path_separator CHAR(1) ;                 set @path_separator = ISNULL(CONVERT(CHAR(1), serverproperty('PathSeparator')), '\') ;                  select @curr_tracefilename = path from sys.traces where is_default = 1 ;                 set @curr_tracefilename = reverse(@curr_tracefilename);                 select @indx  = patindex('%'+@path_separator+'%', @curr_tracefilename) ;                 set @curr_tracefilename = reverse(@curr_tracefilename) ;                 set @base_tracefilename = left( @curr_tracefilename,len(@curr_tracefilename) - @indx) + @path_separator + 'log.trc';                  select  (dense_rank() over (order by StartTime desc))%2 as l1                 ,       convert(int, EventClass) as EventClass                 ,       DatabaseName                 ,       Filename                 ,       (Duration/1000) as Duration                 ,       StartTime                 ,       EndTime                 ,       (IntegerData*8.0/1024) as ChangeInSize                 from ::fn_trace_gettable( @base_tracefilename, default )                 left outer join sys.databases as d on (d.name = DB_NAME())                 where EventClass >=  92      and EventClass <=  95        and ServerName = @@servername   and DatabaseName = db_name()  and (d.create_date < EndTime)                 order by StartTime desc ;                 end     else                 select -1 as l1, 0 as EventClass, 0 DatabaseName, 0 as Filename, 0 as Duration, 0 as StartTime, 0 as EndTime,0 as ChangeInSize                 end try                 begin catch                 select -100 as l1                 ,       ERROR_NUMBER() as EventClass                 ,       ERROR_SEVERITY() DatabaseName                 ,       ERROR_STATE() as Filename                 ,       ERROR_MESSAGE() as Duration                 ,       1 as StartTime, 1 as EndTime,1 as ChangeInSize                 end catch               ",99,97,2,1286,0,99
"       SELECT       db_id() as database_id,       sm.[is_inlineable] AS InlineableScalarCount,​       sm.[inline_type] AS InlineType,​       COUNT_BIG(*) AS ScalarCount, ​       COUNT_BIG(CASE WHEN sm.[definition] LIKE '%getdate%' OR       sm.[definition] LIKE '%getutcdate%' OR ​       sm.[definition] LIKE '%sysdatetime%' OR​       sm.[definition] LIKE '%sysu​tcdatetime%' OR​       sm.[definition] LIKE '%sysdatetimeoffset%' OR​       sm.[definition] LIKE '%CURRENT_TIMESTAMP%'​       THEN 1       END) AS ScalarCountWithDate       FROM    [sys].[objects] o​       INNER JOIN    [sys].[sql_modules] sm       ON o.[object_id] = sm.[object_id]​       WHERE   o.[type] = 'FN'​       GROUP BY ​       sm.[is_inlineable],​       sm.[inline_type]     ",97,59,38,154,0,8793
