"(@_msparam_0 nvarchar(4000),@_msparam_1 nvarchar(4000),@_msparam_2 nvarchar(4000))SELECT udf.name AS [Name], udf.object_id AS [ID], udf.create_date AS [CreateDate], udf.modify_date AS [DateLastModified], ISNULL(sudf.name, N'') AS [Owner], CAST(case when udf.principal_id is null then 1 else 0 end AS bit) AS [IsSchemaOwned], SCHEMA_NAME(udf.schema_id) AS [Schema], CAST(  case      when udf.is_ms_shipped = 1 then 1     when (         select              major_id          from              sys.extended_properties          where              major_id = udf.object_id and              minor_id = 0 and              class = 1 and              name = N'microsoft_database_tools_support')          is not null then 1     else 0 end                        AS bit) AS [IsSystemObject], usrt.name AS [DataType], s1ret_param.name AS [DataTypeSchema], ISNULL(baset.name, N'') AS [SystemType], CAST(CASE WHEN baset.name IN (N'nchar', N'nvarchar') AND ret_param.max_length <> -1 THEN ret_param.max_length/2 ELSE ret_param.max_length END AS int) AS [Length], CAST(ret_param.precision AS int) AS [NumericPrecision], CAST(ret_param.scale AS int) AS [NumericScale], ISNULL(xscret_param.name, N'') AS [XmlSchemaNamespace], ISNULL(s2ret_param.name, N'') AS [XmlSchemaNamespaceSchema], ISNULL( (case ret_param.is_xml_document when 1 then 2 else 1 end), 0) AS [XmlDocumentConstraint], CASE WHEN usrt.is_table_type = 1 THEN N'structured' ELSE N'' END AS [UserType], CAST(ISNULL(OBJECTPROPERTYEX(udf.object_id,N'ExecIsAnsiNullsOn'),0) AS bit) AS [AnsiNullsStatus], CAST(ISNULL(OBJECTPROPERTYEX(udf.object_id, N'IsSchemaBound'),0) AS bit) AS [IsSchemaBound], CAST(CASE WHEN ISNULL(smudf.definition, ssmudf.definition) IS NULL THEN 1 ELSE 0 END AS bit) AS [IsEncrypted], case when amudf.object_id is null then N'' else asmbludf.name end AS [AssemblyName], case when amudf.object_id is null then N'' else amudf.assembly_class end AS [ClassName], case when amudf.object_id is null then N'' else amudf.assembly_method end AS [MethodName], CAST(case when amudf.object_id is null then CAST(smudf.null_on_null_input AS bit) else amudf.null_on_null_input end AS bit) AS [ReturnsNullOnNullInput], case when amudf.object_id is null then case isnull(smudf.execute_as_principal_id, -1) when -1 then 1 when -2 then 2 else 3 end else case isnull(amudf.execute_as_principal_id, -1) when -1 then 1 when -2 then 2 else 3 end end AS [ExecutionContext], case when amudf.object_id is null then ISNULL(user_name(smudf.execute_as_principal_id),N'') else ISNULL(user_name(amudf.execute_as_principal_id), N'') end AS [ExecutionContextPrincipal], CAST(OBJECTPROPERTYEX(udf.object_id, N'IsDeterministic') AS bit) AS [IsDeterministic], (case when 'FN' = udf.type then 1 when 'FS' = udf.type then 1 when 'IF' = udf.type then 3 when 'TF' = udf.type then 2 when 'FT' = udf.type then 2 else 0 end) AS [FunctionType], CASE WHEN udf.type IN ('FN','IF','TF') THEN 1 WHEN udf.type IN ('FS','FT') THEN 2 ELSE 1 END AS [ImplementationType], CAST(ISNULL(OBJECTPROPERTYEX(udf.object_id,N'ExecIsQuotedIdentOn'),0) AS bit) AS [QuotedIdentifierStatus], ret_param.name AS [TableVariableName], ISNULL(sm.uses_native_compilation,0) AS [IsNativelyCompiled], CAST(ISNULL(sm.inline_type,0) AS bit) AS [InlineType], CAST(ISNULL(sm.is_inlineable,0) AS bit) AS [IsInlineable], ISNULL(smudf.definition, ssmudf.definition) AS [Definition] FROM sys.all_objects AS udf LEFT OUTER JOIN sys.database_principals AS sudf ON sudf.principal_id = ISNULL(udf.principal_id, (OBJECTPROPERTY(udf.object_id, 'OwnerId'))) LEFT OUTER JOIN sys.all_parameters AS ret_param ON ret_param.object_id = udf.object_id and ret_param.is_output = @_msparam_0 LEFT OUTER JOIN sys.types AS usrt ON usrt.user_type_id = ret_param.user_type_id LEFT OUTER JOIN sys.schemas AS s1ret_param ON s1ret_param.schema_id = usrt.schema_id LEFT OUTER JOIN sys.types AS baset ON (baset.user_type_id = ret_param.system_type_id and baset.user_type_id = baset.system_type_id) or ((baset.system_type_id = ret_param.system_type_id) and (baset.user_type_id = ret_param.user_type_id) and (baset.is_user_defined = 0) and (baset.is_assembly_type = 1))  LEFT OUTER JOIN sys.xml_schema_collections AS xscret_param ON xscret_param.xml_collection_id = ret_param.xml_collection_id LEFT OUTER JOIN sys.schemas AS s2ret_param ON s2ret_param.schema_id = xscret_param.schema_id LEFT OUTER JOIN sys.sql_modules AS smudf ON smudf.object_id = udf.object_id LEFT OUTER JOIN sys.system_sql_modules AS ssmudf ON ssmudf.object_id = udf.object_id LEFT OUTER JOIN sys.assembly_modules AS amudf ON amudf.object_id = udf.object_id LEFT OUTER JOIN sys.assemblies AS asmbludf ON asmbludf.assembly_id = amudf.assembly_id LEFT OUTER JOIN sys.all_sql_modules AS sm ON sm.object_id = udf.object_id WHERE (udf.type in ('TF', 'FN', 'IF', 'FS', 'FT'))and(udf.name=@_msparam_1 and SCHEMA_NAME(udf.schema_id)=@_msparam_2)",23,23,0,116,0,23
" CREATE   PROCEDURE autoadmin_fetch_system_flags AS BEGIN 	BEGIN TRANSACTION 		DECLARE @value NVARCHAR(MAX)  		SELECT @value = value FROM autoadmin_system_flags WHERE LOWER(name) = LOWER(N'SSMBackup2WAEverConfigured') 		 		IF (LOWER(ISNULL(@value, '')) <> N'true') 		BEGIN 			DECLARE @is_configured BIT 			SET @is_configured = 0 			 			IF EXISTS (SELECT TOP 1 container_url FROM managed_backup.fn_backup_db_config(NULL) WHERE container_url IS NOT NULL) 			BEGIN 				SET @is_configured = 1	 			END 			ELSE IF EXISTS (SELECT TOP 1 container_url FROM managed_backup.fn_backup_instance_config() WHERE container_url IS NOT NULL) 			BEGIN 				SET @is_configured = 1	 			END 			ELSE IF EXISTS (SELECT TOP 1 credential_name FROM smart_admin.fn_backup_db_config(NULL) WHERE credential_name IS NOT NULL) 			BEGIN 				SET @is_configured = 1	 			END 			ELSE IF EXISTS (SELECT TOP 1 credential_name FROM smart_admin.fn_backup_instance_config() WHERE credential_name IS NOT NULL) 			BEGIN 				SET @is_configured = 1	 			END 			 			IF (@is_configured = 1) 			BEGIN 				MERGE autoadmin_system_flags AS target 				USING (SELECT LOWER(N'SSMBackup2WAEverConfigured') as name) AS source 				ON source.name = target.name 				WHEN MATCHED THEN UPDATE SET target.value = N'true' 				WHEN NOT MATCHED THEN INSERT VALUES (N'SSMBackup2WAEverConfigured', N'true'); 			END 		END 	COMMIT TRANSACTION 	     SELECT name, 	value  	FROM autoadmin_system_flags END ",22,22,0,202,2,22
"       SELECT COUNT_BIG(*) AS NumOfNodes FROM [sys].[dm_hadr_cluster_members] WHERE member_type = 0     ",22,20,2,0,0,2017
"declare      @CPU_Usage_Percentage int,      @Total_SQL_Server_Memory_MB int   -- CPU WITH y AS (     SELECT               CONVERT(VARCHAR(5), 100 - ca.c.value('.', 'INT')) AS system_idle,         CONVERT(VARCHAR(30), rb.event_date) AS event_date,         CONVERT(VARCHAR(8000), rb.record) AS record     FROM (            SELECT              CONVERT(XML, dorb.record) AS record,             DATEADD(ms, ( ts.ms_ticks - dorb.timestamp ), GETDATE()) AS event_date         FROM   sys.dm_os_ring_buffers AS dorb             CROSS JOIN (                  SELECT                      dosi.ms_ticks                  FROM sys.dm_os_sys_info AS dosi ) AS ts                 WHERE   dorb.ring_buffer_type = N'RING_BUFFER_SCHEDULER_MONITOR'                         AND record LIKE '%%' ) AS rb             CROSS APPLY rb.record.nodes('/Record/SchedulerMonitorEvent/SystemHealth/SystemIdle') AS ca(c)         )     SELECT @CPU_Usage_Percentage = (select          TOP 1 y.system_idle     FROM y      ORDER BY y.event_date DESC)   -- memory select @Total_SQL_Server_Memory_MB = (select      cntr_value / 1024 from sys.dm_os_performance_counters pc where   [object_name] = 'SQLServer:Memory Manager'         and counter_name = 'Total Server Memory (KB)'                                                                                                         )   select      @CPU_Usage_Percentage           [CPU_Usage_Percentage],      @Total_SQL_Server_Memory_MB     [Total_SQL_Server_Memory_MB]; 	 WITH DB_CPU_Stats AS (SELECT pa.DatabaseID, DB_Name(pa.DatabaseID) AS [Database Name], SUM(qs.total_worker_time/1000) AS [CPU_Time_Ms]  FROM sys.dm_exec_query_stats AS qs WITH (NOLOCK)  CROSS APPLY (SELECT CONVERT(int, value) AS [DatabaseID]               FROM sys.dm_exec_plan_attributes(qs.plan_handle)               WHERE attribute = N'dbid') AS pa  GROUP BY DatabaseID) SELECT ROW_NUMBER() OVER(ORDER BY [CPU_Time_Ms] DESC) AS [CPU Rank],        [Database Name], [CPU_Time_Ms] AS [CPU Time (ms)],        CAST([CPU_Time_Ms] * 1.0 / SUM([CPU_Time_Ms]) OVER() * 100.0 AS DECIMAL(5, 2)) AS [CPU Percent] FROM DB_CPU_Stats WHERE DatabaseID <> 32767 -- ResourceDB ORDER BY [CPU Rank] OPTION (RECOMPILE);   DECLARE @total_buffer INT;  SELECT @total_buffer = cntr_value FROM sys.dm_os_performance_counters  WHERE RTRIM([object_name]) LIKE '%Buffer Manager' AND counter_name = 'Database Pages';  ;WITH src AS (   SELECT    database_id, db_buffer_pages = COUNT_BIG(*)   FROM sys.dm_os_buffer_descriptors   --WHERE database_id BETWEEN 5 AND 32766   GROUP BY database_id ) SELECT [db_name] = CASE [database_id] WHEN 32767  THEN 'Resource DB'  ELSE DB_NAME([database_id]) END, db_buffer_pages, db_buffer_MB = db_buffer_pages / 128, db_buffer_percent = CONVERT(DECIMAL(6,3),  db_buffer_pages * 100.0 / @total_buffer) FROM src ORDER BY db_buffer_MB DESC;  ",20,20,0,20,0,20
"(@_msparam_0 nvarchar(4000))SELECT SCHEMA_NAME(udf.schema_id) AS [Schema], udf.name AS [Name], udf.object_id AS [ID], (case when 'FN' = udf.type then 1 when 'FS' = udf.type then 1 when 'IF' = udf.type then 3 when 'TF' = udf.type then 2 when 'FT' = udf.type then 2 else 0 end) AS [FunctionType], CASE WHEN udf.type IN ('FN','IF','TF') THEN 1 WHEN udf.type IN ('FS','FT') THEN 2 ELSE 1 END AS [ImplementationType], CAST(  case      when udf.is_ms_shipped = 1 then 1     when (         select              major_id          from              sys.extended_properties          where              major_id = udf.object_id and              minor_id = 0 and              class = 1 and              name = N'microsoft_database_tools_support')          is not null then 1     else 0 end                        AS bit) AS [IsSystemObject], CAST(CASE WHEN ISNULL(smudf.definition, ssmudf.definition) IS NULL THEN 1 ELSE 0 END AS bit) AS [IsEncrypted], CAST(ISNULL(OBJECTPROPERTYEX(udf.object_id, N'IsSchemaBound'),0) AS bit) AS [IsSchemaBound], usrt.name AS [DataType] FROM sys.all_objects AS udf LEFT OUTER JOIN sys.sql_modules AS smudf ON smudf.object_id = udf.object_id LEFT OUTER JOIN sys.system_sql_modules AS ssmudf ON ssmudf.object_id = udf.object_id LEFT OUTER JOIN sys.all_parameters AS ret_param ON ret_param.object_id = udf.object_id and ret_param.is_output = @_msparam_0 LEFT OUTER JOIN sys.types AS usrt ON usrt.user_type_id = ret_param.user_type_id WHERE (udf.type in ('TF', 'FN', 'IF', 'FS', 'FT')) ORDER BY [Schema] ASC,[Name] ASC",20,19,1,4183,40,140
"       SELECT database_id, database_guid,       CASE       WHEN db_name(database_id) LIKE '%WideWorldImportersDW%' THEN 'WideWorldImportersDW'       WHEN db_name(database_id) LIKE '%WideWorldImporters%' THEN 'WideWorldImporters'       WHEN db_name(database_id) LIKE '%AdventureWorks2016CTP3%' THEN 'AdventureWorks2016CTP3'       WHEN db_name(database_id) LIKE '%AdventureWorksDW2016CTP3%' THEN 'AdventureWorksDW2016CTP3'       WHEN db_name(database_id) LIKE '%AdventureWorks2014%' THEN 'AdventureWorks2014'       WHEN db_name(database_id) LIKE '%AdventureWorksDW2014%' THEN 'AdventureWorksDW2014'       WHEN db_name(database_id) LIKE '%AdventureWorks2012%' THEN 'AdventureWorks2012'       WHEN db_name(database_id) LIKE '%AdventureWorksDW2012%' THEN 'AdventureWorksDW2012'       WHEN db_name(database_id) LIKE '%AdventureWorks2008%' THEN 'AdventureWorks2008'       WHEN db_name(database_id) LIKE '%AdventureWorksDW2008%' THEN 'AdventureWorksDW2008'       WHEN db_name(database_id) LIKE '%AdventureWorksDW%' THEN 'AdventureWorksDW'       WHEN db_name(database_id) LIKE '%AdventureWorks%' THEN 'AdventureWorks'       WHEN db_name(database_id) LIKE '%ReportServerTempDB%' THEN 'ReportServerTempDB'       WHEN db_name(database_id) LIKE '%ReportServer%' THEN 'ReportServer'       WHEN db_name(database_id) LIKE '%WSS_Content%' THEN 'WSS_Content'       WHEN db_name(database_id) LIKE '%MDW%' THEN 'MDW'       WHEN db_name(database_id) LIKE '%MicrosoftDynamicsAX_baseline%' THEN 'MicrosoftDynamicsAX_baseline'       WHEN db_name(database_id) LIKE '%MicrosoftDynamicsAX%' THEN 'MicrosoftDynamicsAX'       WHEN db_name(database_id) = 'master' THEN 'master'       WHEN db_name(database_id) = 'msdb' THEN 'msdb'       WHEN db_name(database_id) = 'tempdb' THEN 'tempdb'       WHEN db_name(database_id) = 'model' THEN 'model'       WHEN db_name(database_id) LIKE '%SharePoint_Config%' THEN 'SharePoint_Config'       WHEN db_name(database_id) LIKE '%SharePoint_AdminContent%' THEN 'SharePoint_AdminContent'       WHEN db_name(database_id) LIKE '%AppManagement%' THEN 'AppManagement'       WHEN db_name(database_id) LIKE '%Bdc_Service_DB%' THEN 'Bdc_Service_DB'       WHEN db_name(database_id) LIKE '%Search_Service_Application_DB%' THEN 'Search_Service_Application_DB'       WHEN db_name(database_id) LIKE '%Search_Service_Application_AnalyticsReportingStoreDB%' THEN 'Search_Service_Application_AnalyticsReportingStoreDB'       WHEN db_name(database_id) LIKE '%Search_Service_Application_CrawlStoreDB%' THEN 'Search_Service_Application_CrawlStoreDB'       WHEN db_name(database_id) LIKE '%Search_Service_Application_LinkStoreDB%' THEN 'Search_Service_Application_LinkStoreDB'       WHEN db_name(database_id) LIKE '%Secure_Store_Service_DB%' THEN 'Secure_Store_Service_DB'       WHEN db_name(database_id) LIKE '%SharePoint_Logging%' THEN 'SharePoint_Logging'       WHEN db_name(database_id) LIKE '%SettingsServiceDB%' THEN 'SettingsServiceDB'       WHEN db_name(database_id) LIKE '%User Profile Service Application_ProfileDB%' THEN 'User Profile Service Application_ProfileDB'       WHEN db_name(database_id) LIKE '%User Profile Service Application_SyncDB%' THEN 'User Profile Service Application_SyncDB'       WHEN db_name(database_id) LIKE '%User Profile Service Application_SocialDB%' THEN 'User Profile Service Application_SocialDB'       WHEN db_name(database_id) LIKE '%WordAutomationServices%' THEN 'WordAutomationServices'       WHEN db_name(database_id) LIKE '%Managed Metadata Service Application_Metadata%' THEN 'Managed Metadata Service Application_Metadata'       WHEN db_name(database_id) LIKE '%SharePoint Translation Services%' THEN 'SharePoint Translation Services'       WHEN db_name(database_id) LIKE '%ProjectWebApp%' THEN 'ProjectWebApp'       WHEN db_name(database_id) LIKE '%DefaultPowerPivotServiceApplicationDB%' THEN 'DefaultPowerPivotServiceApplicationDB'       WHEN db_name(database_id) LIKE '%PerformancePoint Service%' THEN 'PerformancePoint Service'       WHEN db_name(database_id) LIKE '%SessionStateService%' THEN 'SessionStateService'       WHEN db_name(database_id) = 'SSISDB' THEN 'SSISDB'       WHEN db_name(database_id) = 'DQS_MAIN' THEN 'DQS_MAIN'       ELSE 'Other'       END AS default_database_class       FROM sys.database_recovery_status WITH(nolock)     ",19,10,9,20,0,1795
SELECT target_data 									FROM sys.dm_xe_session_targets xet WITH(nolock) 									JOIN sys.dm_xe_sessions xes WITH(nolock) 									ON xes.address = xet.event_session_address 									WHERE xes.name = 'telemetry_xevents' 									AND xet.target_name = 'ring_buffer',19,17,2,0,0,513004
"(@_msparam_0 nvarchar(4000),@_msparam_1 nvarchar(4000))       select * into #tmpag_availability_groups from master.sys.availability_groups                 select group_id, replica_id, replica_server_name,create_date, modify_date, endpoint_url, read_only_routing_url, primary_role_allow_connections, secondary_role_allow_connections, availability_mode,failover_mode, session_timeout, backup_priority, owner_sid, seeding_mode into #tmpar_availability_replicas from master.sys.availability_replicas                select group_id, replica_id, role,operational_state,recovery_health,synchronization_health,connected_state, last_connect_error_number,last_connect_error_description, last_connect_error_timestamp into #tmpar_availability_replica_states from master.sys.dm_hadr_availability_replica_states              select * into #tmpar_ags from master.sys.dm_hadr_availability_group_states       select ar.group_id, ar.replica_id, ar.replica_server_name, ar.availability_mode, (case when UPPER(ags.primary_replica) = UPPER(ar.replica_server_name) then 1 else 0 end) as role, ars.synchronization_health into #tmpar_availabilty_mode from #tmpar_availability_replicas as ar       left join #tmpar_ags as ags on ags.group_id = ar.group_id       left join #tmpar_availability_replica_states as ars on ar.group_id = ars.group_id and ar.replica_id = ars.replica_id       select am1.replica_id, am1.role, (case when (am1.synchronization_health is null) then 3 else am1.synchronization_health end) as sync_state, (case when (am1.availability_mode is NULL) or (am3.availability_mode is NULL) then null when (am1.role = 1) then 1 when (am1.availability_mode = 0 or am3.availability_mode = 0) then 0 else 1 end) as effective_availability_mode       into #tmpar_replica_rollupstate from #tmpar_availabilty_mode as am1 left join (select group_id, role, availability_mode from #tmpar_availabilty_mode as am2 where am2.role = 1) as am3 on am1.group_id = am3.group_id       drop table #tmpar_availabilty_mode       drop table #tmpar_ags              CREATE TABLE #ror_list_delimited (       replica_id uniqueidentifier,       read_only_routing_list nvarchar(max)       )       select replica_id,read_only_replica_id,routing_priority into #tmp_availability_read_only_routing_lists from sys.availability_read_only_routing_lists        INSERT INTO #ror_list_delimited       SELECT DISTINCT ars.replica_id, a.delimited       FROM #tmpar_availability_replicas AS ars       CROSS APPLY       (         SELECT STUFF(final_list.read_only_routing_list,1,1,'') FROM (         SELECT CASE          WHEN CHARINDEX(',', STUFF(priority_grouped_list.priority_group, 1, 1, '')) = 0 THEN priority_grouped_list.priority_group         ELSE ',(' + STUFF(priority_grouped_list.priority_group, 1, 1, '') + ')'            END          FROM (         SELECT (SELECT  ',N'''+ ars2.replica_server_name +''''         FROM #tmp_availability_read_only_routing_lists AS rrlists         INNER JOIN #tmpar_availability_replicas AS ars2         ON ars2.replica_id = rrlists.read_only_replica_id         WHERE rrlists.routing_priority = prioritylist.routing_priority         AND rrlists.replica_id = ars.replica_id         FOR XML PATH('') ) AS priority_group         FROM         (SELECT  distinct(routing_priority)         FROM #tmp_availability_read_only_routing_lists where replica_id = ars.replica_id) AS prioritylist(routing_priority)) priority_grouped_list         FOR XML PATH('') ) AS final_list(read_only_routing_list) ) AS a(delimited)              select replica_id,join_state into #tmpar_availability_replica_cluster_states from master.sys.dm_hadr_availability_replica_cluster_states        SELECT AR.replica_server_name AS [Name], AR.replica_id AS [UniqueId], ISNULL(arstates.role, 3) AS [Role], ISNULL(arstates.operational_state, 6) AS [OperationalState], ISNULL(arstates.recovery_health, 2) AS [RollupRecoveryState], (case when arrollupstates.sync_state = 3 then 3 when (arrollupstates.effective_availability_mode = 1 or arrollupstates.role = 1) then arrollupstates.sync_state when arrollupstates.sync_state = 2 then 1 else 0 end) AS [RollupSynchronizationState], ISNULL(arstates.connected_state, 2) AS [ConnectionState], ISNULL(AR.create_date, 0) AS [CreateDate], ISNULL(AR.modify_date, 0) AS [DateLastModified], ISNULL(AR.endpoint_url, N'') AS [EndpointUrl], ISNULL(AR.read_only_routing_url, '') AS [ReadonlyRoutingConnectionUrl], ISNULL(rorlists.read_only_routing_list, '') AS [ReadonlyRoutingListDelimited], ISNULL(AR.primary_role_allow_connections, 4) AS [ConnectionModeInPrimaryRole], ISNULL(AR.secondary_role_allow_connections, 3) AS [ConnectionModeInSecondaryRole], ISNULL(AR.availability_mode, 2) AS [AvailabilityMode], ISNULL(AR.failover_mode, 3) AS [FailoverMode], ISNULL(AR.session_timeout, -1) AS [SessionTimeout], ISNULL(arstates.last_connect_error_number,-1) AS [LastConnectErrorNumber], ISNULL(arstates.last_connect_error_description, N'') AS [LastConnectErrorDescription], ISNULL(AR.backup_priority, -1) AS [BackupPriority], ISNULL(arstates.last_connect_error_timestamp, 0) AS [LastConnectErrorTimestamp], suser_sname(AR.owner_sid) AS [Owner], ISNULL(arcs.join_state, 99) AS [JoinState], ISNULL(AR.seeding_mode, 1) AS [SeedingMode] FROM #tmpag_availability_groups AS AG INNER JOIN #tmpar_availability_replicas AS AR ON (AR.replica_server_name IS NOT NULL) AND (AR.group_id=AG.group_id) LEFT OUTER JOIN #tmpar_availability_replica_states AS arstates ON AR.replica_id = arstates.replica_id LEFT OUTER JOIN #tmpar_replica_rollupstate AS arrollupstates ON AR.replica_id = arrollupstates.replica_id LEFT OUTER JOIN #ror_list_delimited AS rorlists ON AR.replica_id = rorlists.replica_id LEFT OUTER JOIN #tmpar_availability_replica_cluster_states AS arcs ON AR.replica_id = arcs.replica_id WHERE (AR.replica_server_name=@_msparam_0)and((AG.name=@_msparam_1))        DROP TABLE #tmpar_availability_replicas              DROP TABLE #tmpar_availability_replica_states              DROP TABLE #tmpar_replica_rollupstate              DROP TABLE #ror_list_delimited       DROP TABLE #tmp_availability_read_only_routing_lists              DROP TABLE #tmpar_availability_replica_cluster_states              drop table #tmpag_availability_groups       ",19,15,4,252,1,58
"(@_msparam_0 nvarchar(4000))       select * into #tmpag_availability_groups from master.sys.availability_groups                 select group_id, replica_id, replica_server_name,create_date, modify_date, endpoint_url, read_only_routing_url, primary_role_allow_connections, secondary_role_allow_connections, availability_mode,failover_mode, session_timeout, backup_priority, owner_sid, seeding_mode into #tmpar_availability_replicas from master.sys.availability_replicas                select group_id, replica_id, role,operational_state,recovery_health,synchronization_health,connected_state, last_connect_error_number,last_connect_error_description, last_connect_error_timestamp into #tmpar_availability_replica_states from master.sys.dm_hadr_availability_replica_states              select * into #tmpar_ags from master.sys.dm_hadr_availability_group_states       select ar.group_id, ar.replica_id, ar.replica_server_name, ar.availability_mode, (case when UPPER(ags.primary_replica) = UPPER(ar.replica_server_name) then 1 else 0 end) as role, ars.synchronization_health into #tmpar_availabilty_mode from #tmpar_availability_replicas as ar       left join #tmpar_ags as ags on ags.group_id = ar.group_id       left join #tmpar_availability_replica_states as ars on ar.group_id = ars.group_id and ar.replica_id = ars.replica_id       select am1.replica_id, am1.role, (case when (am1.synchronization_health is null) then 3 else am1.synchronization_health end) as sync_state, (case when (am1.availability_mode is NULL) or (am3.availability_mode is NULL) then null when (am1.role = 1) then 1 when (am1.availability_mode = 0 or am3.availability_mode = 0) then 0 else 1 end) as effective_availability_mode       into #tmpar_replica_rollupstate from #tmpar_availabilty_mode as am1 left join (select group_id, role, availability_mode from #tmpar_availabilty_mode as am2 where am2.role = 1) as am3 on am1.group_id = am3.group_id       drop table #tmpar_availabilty_mode       drop table #tmpar_ags              select replica_id,join_state into #tmpar_availability_replica_cluster_states from master.sys.dm_hadr_availability_replica_cluster_states        SELECT AR.replica_server_name AS [Name], 'Server[@Name=' + quotename(CAST(         serverproperty(N'Servername')        AS sysname),'''') + ']' + '/AvailabilityGroup[@Name=' + quotename(AG.name,'''') + ']' + '/AvailabilityReplica[@Name=' + quotename(AR.replica_server_name,'''') + ']' AS [Urn], ISNULL(arstates.role, 3) AS [Role], ISNULL(AR.primary_role_allow_connections, 4) AS [ConnectionModeInPrimaryRole], ISNULL(AR.secondary_role_allow_connections, 3) AS [ConnectionModeInSecondaryRole], ISNULL(arstates.connected_state, 2) AS [ConnectionState], (case when arrollupstates.sync_state = 3 then 3 when (arrollupstates.effective_availability_mode = 1 or arrollupstates.role = 1) then arrollupstates.sync_state when arrollupstates.sync_state = 2 then 1 else 0 end) AS [RollupSynchronizationState], ISNULL(arcs.join_state, 99) AS [JoinState] FROM #tmpag_availability_groups AS AG INNER JOIN #tmpar_availability_replicas AS AR ON (AR.replica_server_name IS NOT NULL) AND (AR.group_id=AG.group_id) LEFT OUTER JOIN #tmpar_availability_replica_states AS arstates ON AR.replica_id = arstates.replica_id LEFT OUTER JOIN #tmpar_replica_rollupstate AS arrollupstates ON AR.replica_id = arrollupstates.replica_id LEFT OUTER JOIN #tmpar_availability_replica_cluster_states AS arcs ON AR.replica_id = arcs.replica_id WHERE (AG.name=@_msparam_0) ORDER BY [Name] ASC        DROP TABLE #tmpar_availability_replicas              DROP TABLE #tmpar_availability_replica_states              DROP TABLE #tmpar_replica_rollupstate              DROP TABLE #tmpar_availability_replica_cluster_states              drop table #tmpag_availability_groups       ",19,15,4,265,0,77
